{"ts": 1776849732.6673095, "tag": "H1-baseline", "hypothesis": "Baseline: group=32 tile=64 beta=0.267 ndsp=32 pte=256", "rtl_note": "Reference point. All subsequent experiments compared here.", "config": {"group_size": 32, "tile_size": 64, "beta_star_divisor": 0.267, "n_dsp": 32, "pte_capacity": 256, "codebook_type": "lloyd_max", "retain_fraction": 0.5, "sink_count": 4}, "metrics": {"q4_frac": 0.2151, "q8_frac": 0.7849, "eff_bits": 7.671, "comp_ratio": 2.086, "bw_speedup": 2.086, "norm_err": 0.24021, "decode_sps": 3278.0, "max_seq_on_chip": 100, "fom": 1.6818, "overhead_bits": 0.531, "n_tiles": 4, "lacu_cycles": 2324}, "status": "keep", "improvement_pct": 0.0, "paper_sentence": "H1-baseline: FOM +0.0%. Achieves 2.09x compression, 2.09x BW speedup, norm_err=0.2402, 3278 decode steps/s @ 300 MHz."}
{"ts": 1776849733.1734998, "tag": "H2-group16", "hypothesis": "Reduce group size to 16: less WHT mixing -> lower error, more per-element overhead", "rtl_note": "RTL: 4-stage butterfly instead of 5. Scale UINT16 unchanged. 1.06 b/elem overhead (vs 0.53).", "config": {"group_size": 16, "tile_size": 64, "beta_star_divisor": 0.267, "n_dsp": 32, "pte_capacity": 256, "codebook_type": "lloyd_max", "retain_fraction": 0.5, "sink_count": 4}, "metrics": {"q4_frac": 0.2156, "q8_frac": 0.7844, "eff_bits": 8.2, "comp_ratio": 1.951, "bw_speedup": 1.951, "norm_err": 0.30667, "decode_sps": 3278.0, "max_seq_on_chip": 93, "fom": 1.4933, "overhead_bits": 1.062, "n_tiles": 4, "lacu_cycles": 2324}, "status": "discard", "improvement_pct": -11.21, "paper_sentence": "H2-group16: degrades FOM by -11.2%. Compression 1.95x, BW speedup 1.95x, norm_err=0.3067. Design parameter discarded: tradeoff not Pareto-improving."}
{"ts": 1776849734.776524, "tag": "H3-group64", "hypothesis": "Increase group size to 64: more WHT mixing -> better compression, larger errors", "rtl_note": "RTL: 6-stage butterfly, INT64 intermediates wider range. 0.27 b/elem overhead.", "config": {"group_size": 64, "tile_size": 64, "beta_star_divisor": 0.267, "n_dsp": 32, "pte_capacity": 256, "codebook_type": "lloyd_max", "retain_fraction": 0.5, "sink_count": 4}, "metrics": {"q4_frac": 0.2062, "q8_frac": 0.7937, "eff_bits": 7.441, "comp_ratio": 2.15, "bw_speedup": 2.15, "norm_err": 0.18754, "decode_sps": 3278.0, "max_seq_on_chip": 103, "fom": 1.8108, "overhead_bits": 0.266, "n_tiles": 4, "lacu_cycles": 2324}, "status": "keep", "improvement_pct": 7.67, "paper_sentence": "H3-group64: FOM +7.7%. Achieves 2.15x compression, 2.15x BW speedup, norm_err=0.1875, 3278 decode steps/s @ 300 MHz."}
{"ts": 1776849738.3510218, "tag": "H4-group128", "hypothesis": "Group size 128: maximum compression ratio, expect error degradation", "rtl_note": "RTL: 7-stage butterfly. WHT intermediate width = 16+7=23 bits (still fits INT32). 0.13 b/elem overhead.", "config": {"group_size": 128, "tile_size": 64, "beta_star_divisor": 0.267, "n_dsp": 32, "pte_capacity": 256, "codebook_type": "lloyd_max", "retain_fraction": 0.5, "sink_count": 4}, "metrics": {"q4_frac": 0.2127, "q8_frac": 0.7873, "eff_bits": 7.282, "comp_ratio": 2.197, "bw_speedup": 2.197, "norm_err": 0.14437, "decode_sps": 3278.0, "max_seq_on_chip": 105, "fom": 1.92, "overhead_bits": 0.133, "n_tiles": 4, "lacu_cycles": 2324}, "status": "keep", "improvement_pct": 6.03, "paper_sentence": "H4-group128: FOM +6.0%. Achieves 2.20x compression, 2.20x BW speedup, norm_err=0.1444, 3278 decode steps/s @ 300 MHz."}
{"ts": 1776849739.1582158, "tag": "H5-beta-conservative", "hypothesis": "Higher beta* divisor -> harder to be Q4 -> more Q8 -> better quality, less compression", "rtl_note": "CSR: TIU_BETA_STAR register value increases. More Q8 tokens in MHC.", "config": {"group_size": 32, "tile_size": 64, "beta_star_divisor": 0.4, "n_dsp": 32, "pte_capacity": 256, "codebook_type": "lloyd_max", "retain_fraction": 0.5, "sink_count": 4}, "metrics": {"q4_frac": 0.0622, "q8_frac": 0.9377, "eff_bits": 8.282, "comp_ratio": 1.932, "bw_speedup": 1.932, "norm_err": 0.24074, "decode_sps": 3278.0, "max_seq_on_chip": 92, "fom": 1.557, "overhead_bits": 0.531, "n_tiles": 4, "lacu_cycles": 2324}, "status": "discard", "improvement_pct": -18.91, "paper_sentence": "H5-beta-conservative: degrades FOM by -18.9%. Compression 1.93x, BW speedup 1.93x, norm_err=0.2407. Design parameter discarded: tradeoff not Pareto-improving."}
{"ts": 1776849739.8976254, "tag": "H6-beta-aggressive", "hypothesis": "Lower beta* divisor -> easier to be Q4 -> more Q4 -> more compression, higher error", "rtl_note": "CSR: TIU_BETA_STAR register value decreases. More Q4 tokens in MHC.", "config": {"group_size": 32, "tile_size": 64, "beta_star_divisor": 0.15, "n_dsp": 32, "pte_capacity": 256, "codebook_type": "lloyd_max", "retain_fraction": 0.5, "sink_count": 4}, "metrics": {"q4_frac": 0.4833, "q8_frac": 0.5168, "eff_bits": 6.598, "comp_ratio": 2.425, "bw_speedup": 2.425, "norm_err": 0.2399, "decode_sps": 3278.0, "max_seq_on_chip": 116, "fom": 1.9557, "overhead_bits": 0.531, "n_tiles": 4, "lacu_cycles": 2324}, "status": "keep", "improvement_pct": 1.86, "paper_sentence": "H6-beta-aggressive: FOM +1.9%. Achieves 2.42x compression, 2.42x BW speedup, norm_err=0.2399, 3278 decode steps/s @ 300 MHz."}
{"ts": 1776849740.598538, "tag": "H7-tile128", "hypothesis": "LACU tile size 128: fewer softmax rescales (seq/128 vs seq/64), larger on-chip footprint", "rtl_note": "RTL: ping-pong buffer doubles. Fewer exp() operations per decode step. Latency may improve.", "config": {"group_size": 32, "tile_size": 128, "beta_star_divisor": 0.267, "n_dsp": 32, "pte_capacity": 256, "codebook_type": "lloyd_max", "retain_fraction": 0.5, "sink_count": 4}, "metrics": {"q4_frac": 0.2151, "q8_frac": 0.7849, "eff_bits": 7.671, "comp_ratio": 2.086, "bw_speedup": 2.086, "norm_err": 0.24021, "decode_sps": 3287.0, "max_seq_on_chip": 100, "fom": 1.6865, "overhead_bits": 0.531, "n_tiles": 2, "lacu_cycles": 2316}, "status": "discard", "improvement_pct": -13.76, "paper_sentence": "H7-tile128: degrades FOM by -13.8%. Compression 2.09x, BW speedup 2.09x, norm_err=0.2402. Design parameter discarded: tradeoff not Pareto-improving."}
{"ts": 1776849741.324733, "tag": "H8-tile32", "hypothesis": "LACU tile size 32: more softmax rescales, potentially better numerical precision", "rtl_note": "RTL: buffer halves. More frequent rescale overhead. Tradeoff for non-standard seq_len.", "config": {"group_size": 32, "tile_size": 32, "beta_star_divisor": 0.267, "n_dsp": 32, "pte_capacity": 256, "codebook_type": "lloyd_max", "retain_fraction": 0.5, "sink_count": 4}, "metrics": {"q4_frac": 0.2151, "q8_frac": 0.7849, "eff_bits": 7.671, "comp_ratio": 2.086, "bw_speedup": 2.086, "norm_err": 0.24021, "decode_sps": 3260.0, "max_seq_on_chip": 100, "fom": 1.6725, "overhead_bits": 0.531, "n_tiles": 8, "lacu_cycles": 2340}, "status": "discard", "improvement_pct": -14.48, "paper_sentence": "H8-tile32: degrades FOM by -14.5%. Compression 2.09x, BW speedup 2.09x, norm_err=0.2402. Design parameter discarded: tradeoff not Pareto-improving."}
{"ts": 1776849742.0225568, "tag": "H9-ndsp64", "hypothesis": "Double DSP count to 64: 2x compute throughput, check if still compute-bound", "rtl_note": "ZCU102: 64/2520=2.5% DSP utilisation. Ridge point moves to 1.5 FLOP/B DRAM. Still compute-bound.", "config": {"group_size": 32, "tile_size": 64, "beta_star_divisor": 0.267, "n_dsp": 64, "pte_capacity": 256, "codebook_type": "lloyd_max", "retain_fraction": 0.5, "sink_count": 4}, "metrics": {"q4_frac": 0.2151, "q8_frac": 0.7849, "eff_bits": 7.671, "comp_ratio": 2.086, "bw_speedup": 2.086, "norm_err": 0.24021, "decode_sps": 5112.0, "max_seq_on_chip": 100, "fom": 2.6227, "overhead_bits": 0.531, "n_tiles": 4, "lacu_cycles": 1298}, "status": "keep", "improvement_pct": 34.11, "paper_sentence": "H9-ndsp64: FOM +34.1%. Achieves 2.09x compression, 2.09x BW speedup, norm_err=0.2402, 5112 decode steps/s @ 300 MHz."}
{"ts": 1776849742.819474, "tag": "H10-ndsp128", "hypothesis": "128 DSPs: 4x throughput, roofline may shift to memory-bound for typical workloads", "rtl_note": "ZCU102: 128/2520=5.1% DSP. Ridge point 3.0 FLOP/B. Actual OI=2.0 -> memory-bound! DSP headroom wasted.", "config": {"group_size": 32, "tile_size": 64, "beta_star_divisor": 0.267, "n_dsp": 128, "pte_capacity": 256, "codebook_type": "lloyd_max", "retain_fraction": 0.5, "sink_count": 4}, "metrics": {"q4_frac": 0.2151, "q8_frac": 0.7849, "eff_bits": 7.671, "comp_ratio": 2.086, "bw_speedup": 2.086, "norm_err": 0.24021, "decode_sps": 7097.0, "max_seq_on_chip": 100, "fom": 3.6412, "overhead_bits": 0.531, "n_tiles": 4, "lacu_cycles": 785}, "status": "keep", "improvement_pct": 38.83, "paper_sentence": "H10-ndsp128: FOM +38.8%. Achieves 2.09x compression, 2.09x BW speedup, norm_err=0.2402, 7097 decode steps/s @ 300 MHz."}
{"ts": 1776849743.6121216, "tag": "H11-pte1024", "hypothesis": "Expand PTE to 1024 entries: 4x more tokens can live in SRAM", "rtl_note": "RTL: PTE SRAM = 1024 x 12-bit addr x 3 fields. Needs wider seq_pos field (10-bit vs 8-bit).", "config": {"group_size": 32, "tile_size": 64, "beta_star_divisor": 0.267, "n_dsp": 32, "pte_capacity": 1024, "codebook_type": "lloyd_max", "retain_fraction": 0.5, "sink_count": 4}, "metrics": {"q4_frac": 0.2151, "q8_frac": 0.7849, "eff_bits": 7.671, "comp_ratio": 2.086, "bw_speedup": 2.086, "norm_err": 0.24021, "decode_sps": 3278.0, "max_seq_on_chip": 100, "fom": 1.6818, "overhead_bits": 0.531, "n_tiles": 4, "lacu_cycles": 2324}, "status": "discard", "improvement_pct": -53.81, "paper_sentence": "H11-pte1024: degrades FOM by -53.8%. Compression 2.09x, BW speedup 2.09x, norm_err=0.2402. Design parameter discarded: tradeoff not Pareto-improving."}
{"ts": 1776849743.8513706, "tag": "H12-uniform-codebook", "hypothesis": "Uniform quantization instead of Lloyd-Max: simpler hardware (no LUT), expect higher error", "rtl_note": "RTL: eliminates 256-entry Q4/Q8 codebook LUT. Saves ~512 B SRAM. Tradeoff vs accuracy.", "config": {"group_size": 32, "tile_size": 64, "beta_star_divisor": 0.267, "n_dsp": 32, "pte_capacity": 256, "codebook_type": "uniform", "retain_fraction": 0.5, "sink_count": 4}, "metrics": {"q4_frac": 0.2151, "q8_frac": 0.7849, "eff_bits": 7.671, "comp_ratio": 2.086, "bw_speedup": 2.086, "norm_err": 0.05204, "decode_sps": 3278.0, "max_seq_on_chip": 100, "fom": 1.9827, "overhead_bits": 0.531, "n_tiles": 4, "lacu_cycles": 2324}, "status": "discard", "improvement_pct": -45.55, "paper_sentence": "H12-uniform-codebook: degrades FOM by -45.5%. Compression 2.09x, BW speedup 2.09x, norm_err=0.0520. Design parameter discarded: tradeoff not Pareto-improving."}
{"ts": 1776849744.6079404, "tag": "H13-retain30", "hypothesis": "Aggressive eviction (retain 30%): more tokens evicted, SRAM holds fewer but most important", "rtl_note": "TIU: lower threshold -> more EVICT tags -> MHC cold tier fills faster.", "config": {"group_size": 32, "tile_size": 64, "beta_star_divisor": 0.267, "n_dsp": 32, "pte_capacity": 256, "codebook_type": "lloyd_max", "retain_fraction": 0.3, "sink_count": 4}, "metrics": {"q4_frac": 0.2151, "q8_frac": 0.7849, "eff_bits": 7.671, "comp_ratio": 2.086, "bw_speedup": 2.086, "norm_err": 0.24021, "decode_sps": 3278.0, "max_seq_on_chip": 100, "fom": 1.6818, "overhead_bits": 0.531, "n_tiles": 4, "lacu_cycles": 2324}, "status": "discard", "improvement_pct": -53.81, "paper_sentence": "H13-retain30: degrades FOM by -53.8%. Compression 2.09x, BW speedup 2.09x, norm_err=0.2402. Design parameter discarded: tradeoff not Pareto-improving."}
{"ts": 1776849745.3624427, "tag": "H14-retain70", "hypothesis": "Conservative eviction (retain 70%): keep most tokens, SRAM fills faster", "rtl_note": "TIU: higher threshold -> fewer evictions -> SRAM pressure increases.", "config": {"group_size": 32, "tile_size": 64, "beta_star_divisor": 0.267, "n_dsp": 32, "pte_capacity": 256, "codebook_type": "lloyd_max", "retain_fraction": 0.7, "sink_count": 4}, "metrics": {"q4_frac": 0.2151, "q8_frac": 0.7849, "eff_bits": 7.671, "comp_ratio": 2.086, "bw_speedup": 2.086, "norm_err": 0.24021, "decode_sps": 3278.0, "max_seq_on_chip": 100, "fom": 1.6818, "overhead_bits": 0.531, "n_tiles": 4, "lacu_cycles": 2324}, "status": "discard", "improvement_pct": -53.81, "paper_sentence": "H14-retain70: degrades FOM by -53.8%. Compression 2.09x, BW speedup 2.09x, norm_err=0.2402. Design parameter discarded: tradeoff not Pareto-improving."}
{"ts": 1776849746.1369872, "tag": "H15-sink8", "hypothesis": "Double attention sinks to 8: more tokens bypass eviction scoring", "rtl_note": "TIU: first 8 tokens always RETAIN. Helps models with distributed sink patterns.", "config": {"group_size": 32, "tile_size": 64, "beta_star_divisor": 0.267, "n_dsp": 32, "pte_capacity": 256, "codebook_type": "lloyd_max", "retain_fraction": 0.5, "sink_count": 8}, "metrics": {"q4_frac": 0.2151, "q8_frac": 0.7849, "eff_bits": 7.671, "comp_ratio": 2.086, "bw_speedup": 2.086, "norm_err": 0.24021, "decode_sps": 3278.0, "max_seq_on_chip": 100, "fom": 1.6818, "overhead_bits": 0.531, "n_tiles": 4, "lacu_cycles": 2324}, "status": "discard", "improvement_pct": -53.81, "paper_sentence": "H15-sink8: degrades FOM by -53.8%. Compression 2.09x, BW speedup 2.09x, norm_err=0.2402. Design parameter discarded: tradeoff not Pareto-improving."}
{"ts": 1776849748.8428323, "tag": "H_composed", "hypothesis": "Composed best config: {'group_size': 128, 'beta_star_divisor': 0.15, 'n_dsp': 128}", "rtl_note": "Combined RTL implications from all kept experiments.", "config": {"group_size": 128, "tile_size": 64, "beta_star_divisor": 0.15, "n_dsp": 128, "pte_capacity": 256, "codebook_type": "lloyd_max", "retain_fraction": 0.5, "sink_count": 4}, "metrics": {"q4_frac": 0.4788, "q8_frac": 0.5212, "eff_bits": 6.218, "comp_ratio": 2.573, "bw_speedup": 2.573, "norm_err": 0.14425, "decode_sps": 7097.0, "max_seq_on_chip": 123, "fom": 4.8688, "overhead_bits": 0.133, "n_tiles": 4, "lacu_cycles": 785}, "status": "keep", "improvement_pct": 189.5, "paper_sentence": "H_composed: FOM +189.5%. Achieves 2.57x compression, 2.57x BW speedup, norm_err=0.1442, 7097 decode steps/s @ 300 MHz."}
